{
  "$schema": "https://json-schema.org/draft/2020-12/schema",
  "title": "Causure OpenAI-compatible quota proxy configuration",
  "type": "object",
  "additionalProperties": false,
  "properties": {
    "schema_version": {
      "const": "1.0"
    },
    "service_id": {
      "type": "string",
      "minLength": 3,
      "maxLength": 128,
      "pattern": "^[A-Za-z0-9][A-Za-z0-9._:+/-]{2,127}$"
    },
    "upstream_responses_url": {
      "type": "string",
      "maxLength": 2048,
      "pattern": "^https://[^/?#]+/v1/responses$"
    },
    "worker_proxy_url": {
      "type": "string",
      "maxLength": 2048,
      "pattern": "^https://[^/?#]+/v1$"
    },
    "proxy_container_name": {
      "type": "string",
      "minLength": 2,
      "maxLength": 63,
      "pattern": "^[a-z0-9][a-z0-9.-]{1,62}$"
    },
    "network_name": {
      "type": "string",
      "minLength": 2,
      "maxLength": 128,
      "pattern": "^[A-Za-z0-9][A-Za-z0-9_.-]{1,127}$"
    },
    "lease_cleanup_seconds": {
      "type": "integer",
      "minimum": 30,
      "maximum": 3600
    },
    "upstream_timeout_seconds": {
      "type": "number",
      "minimum": 1,
      "maximum": 300
    },
    "max_request_bytes": {
      "type": "integer",
      "minimum": 1024,
      "maximum": 4194304
    },
    "max_response_bytes": {
      "type": "integer",
      "minimum": 1024,
      "maximum": 16777216
    },
    "models": {
      "type": "array",
      "minItems": 1,
      "maxItems": 1000,
      "uniqueItems": true,
      "items": {
        "type": "object",
        "additionalProperties": false,
        "properties": {
          "model": {
            "type": "string",
            "minLength": 2,
            "maxLength": 128,
            "pattern": "^[A-Za-z0-9][A-Za-z0-9._:/-]{1,127}$"
          },
          "input_usd_per_million_tokens": {
            "$ref": "#/$defs/price"
          },
          "cached_input_usd_per_million_tokens": {
            "$ref": "#/$defs/price"
          },
          "output_usd_per_million_tokens": {
            "$ref": "#/$defs/price"
          },
          "max_input_tokens": {
            "type": "integer",
            "minimum": 1,
            "maximum": 10000000
          },
          "max_output_tokens": {
            "type": "integer",
            "minimum": 1,
            "maximum": 1000000
          }
        },
        "required": [
          "model",
          "input_usd_per_million_tokens",
          "cached_input_usd_per_million_tokens",
          "output_usd_per_million_tokens",
          "max_input_tokens",
          "max_output_tokens"
        ]
      }
    }
  },
  "required": [
    "schema_version",
    "service_id",
    "upstream_responses_url",
    "worker_proxy_url",
    "proxy_container_name",
    "network_name",
    "lease_cleanup_seconds",
    "upstream_timeout_seconds",
    "max_request_bytes",
    "max_response_bytes",
    "models"
  ],
  "$defs": {
    "price": {
      "type": "string",
      "pattern": "^(0|[1-9][0-9]{0,5})\\.[0-9]{1,9}$"
    }
  }
}
